{
  "kind": "task_decision",
  "schema_version": "1.0.0",
  "decision_id": "dec_task_quarantine_profile_1.0.0_20261014T120000Z",
  "task_ref": {
    "id": "task_quarantine_profile",
    "version": "1.0.0"
  },
  "task_checksum": "sha256:6e9a0e18145e0cb4dcfbadd3ad18f9e9097e8a833f3f74b1733b86bbf3f04878",
  "verdict": "ELIGIBLE",
  "prerequisites": [
    {
      "prerequisite_id": "P-CONTRACT-VALID",
      "outcome": "satisfied",
      "established_by": "deterministic_check",
      "check_ref": "aip-task-router:P-CONTRACT-VALID",
      "evidence_refs": [],
      "reason_code": null
    },
    {
      "prerequisite_id": "P-TENANT-SCOPE",
      "outcome": "satisfied",
      "established_by": "deterministic_check",
      "check_ref": "aip-task-router:P-TENANT-SCOPE",
      "evidence_refs": [],
      "reason_code": null
    },
    {
      "prerequisite_id": "P-SNAPSHOT-IMMUTABLE",
      "outcome": "satisfied",
      "established_by": "deterministic_check",
      "check_ref": "aip-task-router:P-SNAPSHOT-IMMUTABLE",
      "evidence_refs": [
        "sha256:82db7b7bad118c6058c9f4e0712e2efe116b8bc3d1dae2afa871072b16af0874"
      ],
      "reason_code": null
    },
    {
      "prerequisite_id": "P-EXEC-OPERATION",
      "outcome": "satisfied",
      "established_by": "deterministic_check",
      "check_ref": "aip-task-router:P-EXEC-OPERATION",
      "evidence_refs": [
        "exec_workspace_demo@1.0.0"
      ],
      "reason_code": null
    },
    {
      "prerequisite_id": "P-RIGHTS-USE",
      "outcome": "satisfied",
      "established_by": "policy_service",
      "check_ref": "aip-task-router:P-RIGHTS-USE",
      "evidence_refs": [
        "evidence_p-rights-use"
      ],
      "reason_code": null
    },
    {
      "prerequisite_id": "P-SENSITIVE-EXCLUSION",
      "outcome": "satisfied",
      "established_by": "deterministic_check",
      "check_ref": "aip-task-router:P-SENSITIVE-EXCLUSION",
      "evidence_refs": [
        "evidence_p-sensitive-exclusion"
      ],
      "reason_code": null
    }
  ],
  "reasons": [],
  "next_actions": [],
  "decided_at": "2026-10-14T12:00:00Z",
  "valid_until": "2026-10-21T12:00:00Z",
  "validity_basis": [
    "max_decision_ttl",
    "exec_workspace_demo@1.0.0"
  ],
  "policy_versions": [
    {
      "id": "exec_workspace_demo",
      "version": "1.0.0"
    }
  ],
  "contract_versions": [
    {
      "id": "aip-contracts",
      "version": "1.0.0"
    }
  ],
  "supersedes": null,
  "agent_proposal_refs": [],
  "decided_by": {
    "service_id": "aip-task-router",
    "service_version": "0.1.0",
    "authority": "router"
  }
}
