{
  "kind": "task_decision",
  "schema_version": "1.0.0",
  "decision_id": "dec_task_propensity_train_no_labels_1.0.0_20261014T120000Z",
  "task_ref": {
    "id": "task_propensity_train_no_labels",
    "version": "1.0.0"
  },
  "task_checksum": "sha256:6979385bfa8da7c01880a2e65cedabfcd09124907ee1e65643949a7ee593e27b",
  "verdict": "PROVISIONAL",
  "prerequisites": [
    {
      "prerequisite_id": "P-CONTRACT-VALID",
      "outcome": "satisfied",
      "established_by": "deterministic_check",
      "check_ref": "aip-task-router:P-CONTRACT-VALID",
      "evidence_refs": [],
      "reason_code": null
    },
    {
      "prerequisite_id": "P-TENANT-SCOPE",
      "outcome": "satisfied",
      "established_by": "deterministic_check",
      "check_ref": "aip-task-router:P-TENANT-SCOPE",
      "evidence_refs": [
        "execution_policy:exec_workspace_demo@1.0.0",
        "output_policy:output_workspace_demo@1.0.0"
      ],
      "reason_code": null
    },
    {
      "prerequisite_id": "P-SNAPSHOT-IMMUTABLE",
      "outcome": "satisfied",
      "established_by": "deterministic_check",
      "check_ref": "aip-task-router:P-SNAPSHOT-IMMUTABLE",
      "evidence_refs": [
        "sha256:db8048da7df66c1ed8eca41bdf344ace6f73ff50487e4fc27db4326794e64ed7"
      ],
      "reason_code": null
    },
    {
      "prerequisite_id": "P-EXEC-OPERATION",
      "outcome": "satisfied",
      "established_by": "deterministic_check",
      "check_ref": "aip-task-router:P-EXEC-OPERATION",
      "evidence_refs": [
        "exec_workspace_demo@1.0.0"
      ],
      "reason_code": null
    },
    {
      "prerequisite_id": "P-RIGHTS-USE",
      "outcome": "satisfied",
      "established_by": "policy_service",
      "check_ref": "aip-task-router:P-RIGHTS-USE",
      "evidence_refs": [
        "evidence_p-rights-use"
      ],
      "reason_code": null
    },
    {
      "prerequisite_id": "P-SENSITIVE-EXCLUSION",
      "outcome": "satisfied",
      "established_by": "deterministic_check",
      "check_ref": "aip-task-router:P-SENSITIVE-EXCLUSION",
      "evidence_refs": [
        "evidence_p-sensitive-exclusion"
      ],
      "reason_code": null
    },
    {
      "prerequisite_id": "P-PROFILE-CONFIRMED",
      "outcome": "satisfied",
      "established_by": "deterministic_check",
      "check_ref": "aip-task-router:P-PROFILE-CONFIRMED",
      "evidence_refs": [
        "prof_web_events_ref@1.0.0"
      ],
      "reason_code": null
    },
    {
      "prerequisite_id": "P-UNITS-DECLARED",
      "outcome": "satisfied",
      "established_by": "deterministic_check",
      "check_ref": "aip-task-router:P-UNITS-DECLARED",
      "evidence_refs": [],
      "reason_code": null
    },
    {
      "prerequisite_id": "P-GRAIN-COMPATIBLE",
      "outcome": "satisfied",
      "established_by": "deterministic_check",
      "check_ref": "aip-task-router:P-GRAIN-COMPATIBLE",
      "evidence_refs": [],
      "reason_code": null
    },
    {
      "prerequisite_id": "P-UNIVERSE-DEFINED",
      "outcome": "satisfied",
      "established_by": "deterministic_check",
      "check_ref": "aip-task-router:P-UNIVERSE-DEFINED",
      "evidence_refs": [
        "universe_web_eligible"
      ],
      "reason_code": null
    },
    {
      "prerequisite_id": "P-LABELS-QUALIFIED",
      "outcome": "missing",
      "established_by": "deterministic_check",
      "check_ref": "aip-task-router:P-LABELS-QUALIFIED",
      "evidence_refs": [
        "label_report_demo_001"
      ],
      "reason_code": "unsupported_outcome_probability"
    },
    {
      "prerequisite_id": "P-FEATURE-TIMING",
      "outcome": "satisfied",
      "established_by": "deterministic_check",
      "check_ref": "aip-task-router:P-FEATURE-TIMING",
      "evidence_refs": [
        "evidence_p-feature-timing"
      ],
      "reason_code": null
    }
  ],
  "reasons": [
    {
      "code": "unsupported_outcome_probability",
      "detail": "Mature outcome labels exist for a named event, cutoff and horizon",
      "evidence_refs": [
        "label_report_demo_001"
      ]
    }
  ],
  "next_actions": [
    "Supply qualified labels: named event, cutoff, horizon, mature windows, coverage"
  ],
  "decided_at": "2026-10-14T12:00:00Z",
  "valid_until": "2026-10-21T12:00:00Z",
  "validity_basis": [
    "max_decision_ttl",
    "exec_workspace_demo@1.0.0"
  ],
  "policy_versions": [
    {
      "id": "exec_workspace_demo",
      "version": "1.0.0"
    }
  ],
  "contract_versions": [
    {
      "id": "aip-contracts",
      "version": "1.0.0"
    }
  ],
  "supersedes": null,
  "agent_proposal_refs": [],
  "decided_by": {
    "service_id": "aip-task-router",
    "service_version": "0.1.0",
    "authority": "router"
  }
}
